{
  "$schema": "https://json-schema.org/draft/2020-12/schema",
  "title": "SpatialContextFrame",
  "description": "Schema for Spatial Context Frame connecting Generation Layer (MISO) and Runtime Layer (MIMO)",
  "type": "object",
  "required": [
    "frame_id",
    "image_path",
    "K",
    "Rt",
    "source"
  ],
  "properties": {
    "frame_id": {
      "type": "string",
      "description": "Unique identifier for the frame (e.g. frame_0001, view_front)"
    },
    "image_path": {
      "type": "string",
      "description": "Relative or absolute path to the RGB image file"
    },
    "K": {
      "type": "array",
      "description": "3x3 Camera intrinsic calibration matrix [[fx, 0, cx], [0, fy, cy], [0, 0, 1]]",
      "items": {
        "type": "array",
        "items": { "type": "number" },
        "minItems": 3,
        "maxItems": 3
      },
      "minItems": 3,
      "maxItems": 3
    },
    "Rt": {
      "type": "array",
      "description": "4x4 Extrinsic matrix [R|t] in OpenCV convention (mapping world points to camera coordinate system: X_c = R * X_w + t)",
      "items": {
        "type": "array",
        "items": { "type": "number" },
        "minItems": 4,
        "maxItems": 4
      },
      "minItems": 4,
      "maxItems": 4
    },
    "depth_path": {
      "type": "string",
      "description": "Optional path to the aligned depth map (e.g. 16-bit PNG or float32 npy/exr)"
    },
    "timestamp": {
      "type": "string",
      "description": "ISO 8601 timestamp of capture or generation"
    },
    "source": {
      "type": "string",
      "enum": [
        "capture",
        "generated"
      ],
      "description": "Origin of the frame: 'capture' for multi-view photography, 'generated' for generative camera/diffusion"
    },
    "confidence": {
      "type": "number",
      "minimum": 0.0,
      "maximum": 1.0,
      "description": "Optional pose/depth confidence score in range [0.0, 1.0]"
    },
    "metadata": {
      "type": "object",
      "description": "Optional frame or scene metadata such as object dimensions, physical scale, or reference markers"
    }
  },
  "additionalProperties": false
}
