[
  {
    "frame_id": "view_front",
    "image_path": "assets/p3/render_front.png",
    "K": [
      [
        623.5382907247958,
        0,
        640
      ],
      [
        0,
        623.5382907247958,
        360
      ],
      [
        0,
        0,
        1
      ]
    ],
    "Rt": [
      [
        1,
        0,
        0,
        0
      ],
      [
        0,
        -1,
        0,
        0.4
      ],
      [
        0,
        0,
        -1,
        3.2
      ],
      [
        0,
        0,
        0,
        1
      ]
    ],
    "source": "generated",
    "timestamp": "2026-09-06T00:00:00.000Z",
    "confidence": 1
  },
  {
    "frame_id": "view_45deg",
    "image_path": "assets/p3/render_45deg.png",
    "K": [
      [
        623.5382907247958,
        0,
        640
      ],
      [
        0,
        623.5382907247958,
        360
      ],
      [
        0,
        0,
        1
      ]
    ],
    "Rt": [
      [
        0.7999999999999999,
        -2.7755575615628914e-17,
        -0.6000000000000001,
        2.220446049250313e-16
      ],
      [
        0.20655278949505393,
        -0.9388763158866087,
        0.2754037193267385,
        0.2816628947659827
      ],
      [
        -0.5633257895319652,
        -0.34425464915842313,
        -0.7511010527092868,
        3.298585456481618
      ],
      [
        0,
        0,
        0,
        1
      ]
    ],
    "source": "generated",
    "timestamp": "2026-09-06T00:00:00.000Z",
    "confidence": 1
  },
  {
    "frame_id": "view_top",
    "image_path": "assets/p3/render_top.png",
    "K": [
      [
        623.5382907247958,
        0,
        640
      ],
      [
        0,
        623.5382907247958,
        360
      ],
      [
        0,
        0,
        1
      ]
    ],
    "Rt": [
      [
        1,
        0,
        0,
        0
      ],
      [
        0,
        -0.00023809523134643573,
        0.99999997165533,
        -2.9989032090949053e-16
      ],
      [
        0,
        -0.99999997165533,
        -0.00023809523134643573,
        4.200000119047618
      ],
      [
        0,
        0,
        0,
        1
      ]
    ],
    "source": "generated",
    "timestamp": "2026-09-06T00:00:00.000Z",
    "confidence": 1
  }
]